{
  "certificates": [
    {
      "actions": [
        0,
        1,
        2,
        3,
        4,
        5
      ],
      "domain": 0,
      "event": 0,
      "id": "track-0-0",
      "request": 0,
      "transport": 0,
      "unavailablePlacements": []
    },
    {
      "actions": [
        72,
        73,
        74,
        75,
        76,
        77,
        78,
        79
      ],
      "domain": 1,
      "event": 0,
      "id": "track-0-1",
      "request": 0,
      "transport": 6,
      "unavailablePlacements": []
    },
    {
      "actions": [
        168,
        169,
        170,
        171,
        172,
        173,
        174,
        175,
        176,
        177,
        178,
        179
      ],
      "domain": 2,
      "event": 0,
      "id": "track-0-2",
      "request": 0,
      "transport": 18,
      "unavailablePlacements": []
    },
    {
      "actions": [
        6,
        7,
        8,
        9,
        10,
        11
      ],
      "domain": 0,
      "event": 1,
      "id": "track-1-0",
      "request": 1,
      "transport": 0,
      "unavailablePlacements": []
    },
    {
      "actions": [
        80,
        81,
        82,
        83,
        84,
        85,
        86,
        87
      ],
      "domain": 1,
      "event": 1,
      "id": "track-1-1",
      "request": 1,
      "transport": 7,
      "unavailablePlacements": []
    },
    {
      "actions": [
        180,
        181,
        182,
        183,
        184,
        185,
        186,
        187,
        188,
        189,
        190,
        191
      ],
      "domain": 2,
      "event": 1,
      "id": "track-1-2",
      "request": 1,
      "transport": 19,
      "unavailablePlacements": []
    },
    {
      "actions": [
        12,
        13,
        14,
        15,
        16,
        17
      ],
      "domain": 0,
      "event": 2,
      "id": "track-2-0",
      "request": 2,
      "transport": 1,
      "unavailablePlacements": []
    },
    {
      "actions": [
        88,
        89,
        90,
        91,
        92,
        93,
        94,
        95
      ],
      "domain": 1,
      "event": 2,
      "id": "track-2-1",
      "request": 2,
      "transport": 8,
      "unavailablePlacements": []
    },
    {
      "actions": [
        192,
        193,
        194,
        195,
        196,
        197,
        198,
        199,
        200,
        201,
        202,
        203
      ],
      "domain": 2,
      "event": 2,
      "id": "track-2-2",
      "request": 2,
      "transport": 20,
      "unavailablePlacements": []
    },
    {
      "actions": [
        18,
        19,
        20,
        21,
        22,
        23
      ],
      "domain": 0,
      "event": 3,
      "id": "track-3-0",
      "request": 3,
      "transport": 1,
      "unavailablePlacements": []
    },
    {
      "actions": [
        96,
        97,
        98,
        99,
        100,
        101,
        102,
        103
      ],
      "domain": 1,
      "event": 3,
      "id": "track-3-1",
      "request": 3,
      "transport": 9,
      "unavailablePlacements": []
    },
    {
      "actions": [
        204,
        205,
        206,
        207,
        208,
        209,
        210,
        211,
        212,
        213,
        214,
        215
      ],
      "domain": 2,
      "event": 3,
      "id": "track-3-2",
      "request": 3,
      "transport": 21,
      "unavailablePlacements": []
    },
    {
      "actions": [
        24,
        25,
        26,
        27,
        28,
        29
      ],
      "domain": 0,
      "event": 4,
      "id": "track-4-0",
      "request": 4,
      "transport": 2,
      "unavailablePlacements": []
    },
    {
      "actions": [
        104,
        105,
        106,
        107,
        108,
        109,
        110,
        111
      ],
      "domain": 1,
      "event": 4,
      "id": "track-4-1",
      "request": 4,
      "transport": 10,
      "unavailablePlacements": []
    },
    {
      "actions": [
        216,
        217,
        218,
        219,
        220,
        221,
        222,
        223,
        224,
        225,
        226,
        227
      ],
      "domain": 2,
      "event": 4,
      "id": "track-4-2",
      "request": 4,
      "transport": 22,
      "unavailablePlacements": []
    },
    {
      "actions": [
        30,
        31,
        32,
        33,
        34,
        35
      ],
      "domain": 0,
      "event": 5,
      "id": "track-5-0",
      "request": 5,
      "transport": 2,
      "unavailablePlacements": []
    },
    {
      "actions": [
        112,
        113,
        114,
        115,
        116,
        117,
        118,
        119
      ],
      "domain": 1,
      "event": 5,
      "id": "track-5-1",
      "request": 5,
      "transport": 11,
      "unavailablePlacements": []
    },
    {
      "actions": [
        228,
        229,
        230,
        231,
        232,
        233,
        234,
        235,
        236,
        237,
        238,
        239
      ],
      "domain": 2,
      "event": 5,
      "id": "track-5-2",
      "request": 5,
      "transport": 23,
      "unavailablePlacements": []
    },
    {
      "actions": [
        36,
        37,
        38,
        39,
        40,
        41
      ],
      "domain": 0,
      "event": 6,
      "id": "track-6-0",
      "request": 6,
      "transport": 3,
      "unavailablePlacements": []
    },
    {
      "actions": [
        120,
        121,
        122,
        123,
        124,
        125,
        126,
        127
      ],
      "domain": 1,
      "event": 6,
      "id": "track-6-1",
      "request": 6,
      "transport": 12,
      "unavailablePlacements": []
    },
    {
      "actions": [
        240,
        241,
        242,
        243,
        244,
        245,
        246,
        247,
        248,
        249,
        250,
        251
      ],
      "domain": 2,
      "event": 6,
      "id": "track-6-2",
      "request": 6,
      "transport": 24,
      "unavailablePlacements": []
    },
    {
      "actions": [
        42,
        43,
        44,
        45,
        46,
        47
      ],
      "domain": 0,
      "event": 7,
      "id": "track-7-0",
      "request": 7,
      "transport": 3,
      "unavailablePlacements": []
    },
    {
      "actions": [
        128,
        129,
        130,
        131,
        132,
        133,
        134,
        135
      ],
      "domain": 1,
      "event": 7,
      "id": "track-7-1",
      "request": 7,
      "transport": 13,
      "unavailablePlacements": []
    },
    {
      "actions": [
        252,
        253,
        254,
        255,
        256,
        257,
        258,
        259,
        260,
        261,
        262,
        263
      ],
      "domain": 2,
      "event": 7,
      "id": "track-7-2",
      "request": 7,
      "transport": 25,
      "unavailablePlacements": []
    },
    {
      "actions": [
        48,
        49,
        50,
        51,
        52,
        53
      ],
      "domain": 0,
      "event": 8,
      "id": "track-8-0",
      "request": 8,
      "transport": 4,
      "unavailablePlacements": []
    },
    {
      "actions": [
        136,
        137,
        138,
        139,
        140,
        141,
        142,
        143
      ],
      "domain": 1,
      "event": 8,
      "id": "track-8-1",
      "request": 8,
      "transport": 14,
      "unavailablePlacements": []
    },
    {
      "actions": [
        264,
        265,
        266,
        267,
        268,
        269,
        270,
        271,
        272,
        273,
        274,
        275
      ],
      "domain": 2,
      "event": 8,
      "id": "track-8-2",
      "request": 8,
      "transport": 26,
      "unavailablePlacements": []
    },
    {
      "actions": [
        54,
        55,
        56,
        57,
        58,
        59
      ],
      "domain": 0,
      "event": 9,
      "id": "track-9-0",
      "request": 9,
      "transport": 4,
      "unavailablePlacements": []
    },
    {
      "actions": [
        144,
        145,
        146,
        147,
        148,
        149,
        150,
        151
      ],
      "domain": 1,
      "event": 9,
      "id": "track-9-1",
      "request": 9,
      "transport": 15,
      "unavailablePlacements": []
    },
    {
      "actions": [
        276,
        277,
        278,
        279,
        280,
        281,
        282,
        283,
        284,
        285,
        286,
        287
      ],
      "domain": 2,
      "event": 9,
      "id": "track-9-2",
      "request": 9,
      "transport": 27,
      "unavailablePlacements": []
    },
    {
      "actions": [
        60,
        61,
        62,
        63,
        64,
        65
      ],
      "domain": 0,
      "event": 10,
      "id": "track-10-0",
      "request": 10,
      "transport": 5,
      "unavailablePlacements": []
    },
    {
      "actions": [
        152,
        153,
        154,
        155,
        156,
        157,
        158,
        159
      ],
      "domain": 1,
      "event": 10,
      "id": "track-10-1",
      "request": 10,
      "transport": 16,
      "unavailablePlacements": []
    },
    {
      "actions": [
        288,
        289,
        290,
        291,
        292,
        293,
        294,
        295,
        296,
        297,
        298,
        299
      ],
      "domain": 2,
      "event": 10,
      "id": "track-10-2",
      "request": 10,
      "transport": 28,
      "unavailablePlacements": []
    },
    {
      "actions": [
        66,
        67,
        68,
        69,
        70,
        71
      ],
      "domain": 0,
      "event": 11,
      "id": "track-11-0",
      "request": 11,
      "transport": 5,
      "unavailablePlacements": []
    },
    {
      "actions": [
        160,
        161,
        162,
        163,
        164,
        165,
        166,
        167
      ],
      "domain": 1,
      "event": 11,
      "id": "track-11-1",